{
  "schema_version": "2.1",
  "radar": {
    "date": "2026-09-12",
    "generated_at": "2026-09-12T22:30:00-03:00",
    "timezone": "America/Sao_Paulo",
    "status": "PARTIAL",
    "market_regime": "CAUTION",
    "institutional_sentiment": "CAUTION",
    "daily_bias": "SELETIVO",
    "risk_level": "ALTO",
    "summary": "Wall Street recuperou em 11/09, mas inflação americana, Treasury 10Y próximo de 5%, Fed e petróleo acima de US$100 mantêm o regime CAUTION. Power/Data Center continua sendo o tema preferido."
  },
  "global_market": {
    "dow": {
      "value": 52573.29,
      "change_pct": 0.98,
      "market_date": "2026-09-11",
      "market_status": "CLOSED"
    },
    "sp500": {
      "value": 7656.98,
      "change_pct": 0.86,
      "market_date": "2026-09-11",
      "market_status": "CLOSED"
    },
    "nasdaq": {
      "value": 26333.04,
      "change_pct": 0.96,
      "market_date": "2026-09-11",
      "market_status": "CLOSED"
    },
    "russell2000": {
      "value": 2903.94,
      "change_pct": 0.45,
      "market_date": "2026-09-11",
      "market_status": "CLOSED"
    },
    "vix": {
      "value": 15.88,
      "change_pct": null,
      "market_date": "2026-09-11",
      "market_status": "CLOSED"
    },
    "treasury_2y": {
      "value": 4.64,
      "change_pct": null,
      "market_date": "2026-09-11",
      "market_status": "CLOSED"
    },
    "treasury_10y": {
      "value": 4.97,
      "change_pct": null,
      "market_date": "2026-09-11",
      "market_status": "CLOSED"
    },
    "dollar_index": {
      "value": 99.1,
      "change_pct": null,
      "market_date": "2026-09-11",
      "market_status": "CLOSED"
    },
    "brent": {
      "value": 104.61,
      "change_pct": -2.81,
      "market_date": "2026-09-11",
      "market_status": "CLOSED"
    },
    "wti": {
      "value": 100.05,
      "change_pct": -2.37,
      "market_date": "2026-09-11",
      "market_status": "CLOSED"
    }
  },
  "macro": [
    {
      "event": "US Consumer Price Index August",
      "start_date": "2026-09-11",
      "end_date": null,
      "time": null,
      "timezone": "America/New_York",
      "result": 0.4,
      "expectation": 0.4,
      "previous": 0.1,
      "impact": "NEGATIVO",
      "magnitude": "FORTE",
      "win_impact": "NEGATIVO",
      "wdo_impact": "POSITIVO",
      "comment": "CPI avançou 0.4% M/M e 3.4% A/A, aumentando as apostas em aperto monetário pelo Fed."
    },
    {
      "event": "Federal Reserve FOMC Meeting",
      "start_date": "2026-09-15",
      "end_date": "2026-09-16",
      "time": null,
      "timezone": "America/New_York",
      "result": null,
      "expectation": null,
      "previous": null,
      "impact": "NÃO DISPONÍVEL",
      "magnitude": "CRITICA",
      "win_impact": "ALTA VOLATILIDADE",
      "wdo_impact": "ALTA VOLATILIDADE",
      "comment": "Principal catalisador macro da próxima semana."
    }
  ],
  "brazil": {
    "ibovespa": {
      "value": 186967,
      "change_pct": -0.69,
      "market_date": "2026-09-11",
      "market_status": "CLOSED"
    },
    "ibovespa_futures": {
      "value": 188987,
      "change_pct": -0.75,
      "market_date": "2026-09-11",
      "market_status": "CLOSED"
    },
    "dollar_brl": {
      "value": 5.125,
      "change_pct": 0.43,
      "market_date": "2026-09-11",
      "market_status": "CLOSED"
    },
    "selic": 14.0,
    "ipca": -0.32,
    "gdp": 2.0,
    "fiscal_risk": "MODERADO",
    "political_risk": "MODERADO",
    "market_bias": "CAUTION",
    "comment": "PIB do 2T26 cresceu 0.5% T/T; inflação doméstica favorece expectativa de cortes de juros, mas o ambiente externo permanece adverso."
  },
  "foreign_flow": {
    "latest_date": "2026-09-09",
    "daily_flow_brl": 0.20738,
    "monthly_flow_brl": 5.38113,
    "year_to_date_flow_brl": 23.67,
    "trend": "MELHORANDO",
    "status": "ENTRADA",
    "data_delay": "D+2 / fonte secundária",
    "comment": "Fluxo estrangeiro segue comprador. Última sessão recuperada: entrada de R$207,38 milhões em 09/09; setembro acumula aproximadamente R$5,38 bilhões."
  },
  "futures": {
    "win": {
      "value": 188987,
      "change_pct": -0.75,
      "bias": "CAUTION",
      "buy_confidence": null,
      "sell_confidence": null
    },
    "wdo": {
      "value": null,
      "change_pct": null,
      "bias": "CAUTION",
      "risk_indicator": null
    },
    "di": {
      "value": null,
      "change_pct": null,
      "bias": "NÃO DISPONÍVEL"
    },
    "conditions": {
      "win_above_vwap": null,
      "wdo_below_vwap": null,
      "di_losing_strength": null,
      "buy_volume": null
    }
  },
  "sectors": [
    {
      "sector": "Power/Data Center",
      "performance_pct": null,
      "trend": "MELHORANDO",
      "bias": "BULLISH_SELETIVO",
      "comment": "Principal tema estrutural do Radar."
    },
    {
      "sector": "Semiconductors/AI",
      "performance_pct": null,
      "trend": "MELHORANDO",
      "bias": "BULLISH_SELETIVO",
      "comment": "MRVL mantém momentum favorável e exposição a AI infrastructure."
    },
    {
      "sector": "Nuclear",
      "performance_pct": null,
      "trend": "PIORANDO",
      "bias": "BULLISH_VOLATIL",
      "comment": "Tese estrutural positiva, porém LEU apresenta deterioração técnica."
    },
    {
      "sector": "Healthcare",
      "performance_pct": null,
      "trend": "ESTAVEL",
      "bias": "NEUTRAL",
      "comment": "Seleção individual permanece necessária."
    },
    {
      "sector": "Cybersecurity",
      "performance_pct": null,
      "trend": "ESTAVEL",
      "bias": "BULLISH",
      "comment": "Tema estrutural positivo."
    },
    {
      "sector": "Cloud",
      "performance_pct": null,
      "trend": "ESTAVEL",
      "bias": "BULLISH",
      "comment": "Demanda estrutural ligada a AI e data centers."
    }
  ],
  "power_data_center": [
    {
      "ticker": "VRT",
      "company": "Vertiv Holdings",
      "price": 246.96,
      "change_pct": -6.02,
      "trend": "PIORANDO",
      "institutional_bias": "CAUTION",
      "recommendation": "HOLD",
      "comment": "Entrada 253.00 e alvo 265.65. Tese estrutural permanece positiva, mas técnico deteriorou."
    },
    {
      "ticker": "POWL",
      "company": "Powell Industries",
      "price": 182.5,
      "change_pct": 3.17,
      "trend": "MELHORANDO",
      "institutional_bias": "POSITIVO",
      "recommendation": "HOLD",
      "comment": "Entrada 182.46 e alvo 200.71. Backlog e demanda de infraestrutura elétrica sustentam a tese."
    },
    {
      "ticker": "BE",
      "company": "Bloom Energy",
      "price": 270.4,
      "change_pct": 4.61,
      "trend": "MELHORANDO",
      "institutional_bias": "CAUTION",
      "recommendation": "WATCH",
      "comment": "Snapshot intraday recuperado para 11/09; posição do usuário permanece encerrada e BE integra apenas o universo temático."
    },
    {
      "ticker": "GEV",
      "company": "GE Vernova",
      "price": 957.27,
      "change_pct": 3.61,
      "trend": "MELHORANDO",
      "institutional_bias": "POSITIVO",
      "recommendation": "WATCH",
      "comment": "Exposição estrutural à expansão da infraestrutura elétrica."
    }
  ],
  "nuclear": [
    {
      "ticker": "LEU",
      "company": "Centrus Energy",
      "price": 152.31,
      "change_pct": -8.18,
      "trend": "PIORANDO",
      "catalyst": "DOE HALEU, Radiant e expansão doméstica de enriquecimento",
      "recommendation": "WATCH",
      "comment": "Tese nuclear permanece positiva estruturalmente, mas a forte correção exige confirmação técnica."
    }
  ],
  "swing_trades": [
    {
      "ticker": "POWL",
      "company": "Powell Industries",
      "price": 182.5,
      "entry": 182.46,
      "stop": null,
      "target": 200.71,
      "risk_reward": null,
      "technical_bias": "POSITIVO",
      "recommendation": "HOLD",
      "thesis": "Fundamentos fortes e preço praticamente na entrada.",
      "catalysts": [
        "Record backlog",
        "Data center demand",
        "Electrical infrastructure"
      ]
    },
    {
      "ticker": "MRVL",
      "company": "Marvell Technology",
      "price": 236.1,
      "entry": 197.07,
      "stop": null,
      "target": 267.65,
      "risk_reward": null,
      "technical_bias": "POSITIVO",
      "recommendation": "HOLD",
      "thesis": "AI/custom silicon e momentum positivo.",
      "catalysts": [
        "AI Infra Summit",
        "AI connectivity",
        "Custom silicon"
      ]
    },
    {
      "ticker": "LEU",
      "company": "Centrus Energy",
      "price": 152.31,
      "entry": null,
      "stop": null,
      "target": null,
      "risk_reward": null,
      "technical_bias": "CAUTION",
      "recommendation": "WATCH",
      "thesis": "HALEU continua estruturalmente atraente, mas momentum deteriorou.",
      "catalysts": [
        "DOE HALEU",
        "Radiant"
      ]
    },
    {
      "ticker": "VRT",
      "company": "Vertiv Holdings",
      "price": 246.96,
      "entry": 253.0,
      "stop": null,
      "target": 265.65,
      "risk_reward": null,
      "technical_bias": "CAUTION",
      "recommendation": "HOLD",
      "thesis": "Infraestrutura AI forte, mas técnico de curto prazo deteriorado.",
      "catalysts": [
        "AI data centers",
        "Power infrastructure"
      ]
    },
    {
      "ticker": "CRSP",
      "company": "CRISPR Therapeutics",
      "price": 51.72,
      "entry": 54.41,
      "stop": null,
      "target": null,
      "risk_reward": null,
      "technical_bias": "CAUTION",
      "recommendation": "WATCH",
      "thesis": "Assimetria biotech elevada e preço abaixo da entrada.",
      "catalysts": [
        "Clinical pipeline",
        "Gene editing commercialization"
      ]
    }
  ],
  "penny_stocks": [
    {
      "ticker": "NEPH",
      "company": "Nephros",
      "price": 4.47,
      "change_pct": -1.11,
      "volume": 41790,
      "risk_level": "ALTO",
      "catalyst": "Healthcare filtration",
      "recommendation": "WATCH",